<?xml version="1.0" encoding="UTF-8"?>
<query xmlns:xsi="http://www.w3.org/2001/XMLSchema-instance" xsi:noNamespaceSchemaLocation="xsd/object-query.xsd">

	<object>com.warework.service.datastore.query.oo.SampleBean</object>

	<where>
		<and>
			<expression>
				<attribute>name</attribute>
				<operator>EQUAL_TO</operator>
				<value-operand>
					<type>date</type>
					<value>13/08/1978</value>
					<format>dd/MM/yyyy</format>
					<locale>en_GB</locale>
					<time-zone>europe/london</time-zone>
				</value-operand>
			</expression>
			<expression>
				<attribute>name</attribute>
				<operator>NOT_EQUAL_TO</operator>
				<value-operand>
					<type>java.util.Date</type>
					<value>13/08/1978</value>
					<format>dd/MM/yyyy</format>
					<locale>en_GB</locale>
					<time-zone>europe/london</time-zone>
				</value-operand>
			</expression>
			<expression>
				<attribute>name</attribute>
				<operator>GREATER_THAN</operator>
				<value-operand>
					<type>java.util.Date</type>
					<value>13/08/1978</value>
					<format>dd/MM/yyyy</format>
					<locale>en_GB</locale>
					<time-zone>europe/london</time-zone>
				</value-operand>
			</expression>
			<expression>
				<attribute>name</attribute>
				<operator>GREATER_THAN_OR_EQUAL_TO</operator>
				<value-operand>
					<type>java.util.Date</type>
					<value>13/08/1978</value>
					<format>dd/MM/yyyy</format>
					<locale>en_GB</locale>
					<time-zone>europe/london</time-zone>
				</value-operand>
			</expression>
			<expression>
				<attribute>name</attribute>
				<operator>LESS_THAN</operator>
				<value-operand>
					<type>java.util.Date</type>
					<value>13/08/1978</value>
					<format>dd/MM/yyyy</format>
					<locale>en_GB</locale>
					<time-zone>europe/london</time-zone>
				</value-operand>
			</expression>
			<expression>
				<attribute>name</attribute>
				<operator>LESS_THAN_OR_EQUAL_TO</operator>
				<value-operand>
					<type>java.util.Date</type>
					<value>13/08/1978</value>
					<format>dd/MM/yyyy</format>
					<locale>en_GB</locale>
					<time-zone>europe/london</time-zone>
				</value-operand>
			</expression>
			<expression>
				<attribute>name</attribute>
				<operator>LIKE</operator>
				<value-operand>
					<type>java.util.Date</type>
					<value>13/08/1978</value>
					<format>dd/MM/yyyy</format>
					<locale>en_GB</locale>
					<time-zone>europe/london</time-zone>
				</value-operand>
			</expression>
			<expression>
				<attribute>name</attribute>
				<operator>NOT_LIKE</operator>
				<value-operand>
					<type>java.util.Date</type>
					<value>13/08/1978</value>
					<format>dd/MM/yyyy</format>
					<locale>en_GB</locale>
					<time-zone>europe/london</time-zone>
				</value-operand>
			</expression>
			<expression>
				<attribute>name</attribute>
				<operator>IS_NULL</operator>
			</expression>
			<expression>
				<attribute>name</attribute>
				<operator>IS_NOT_NULL</operator>
			</expression>
		</and>
	</where>

</query>