<?xml version="1.0" encoding="UTF-8"?>
<query xmlns:xsi="http://www.w3.org/2001/XMLSchema-instance" xsi:noNamespaceSchemaLocation="xsd/object-query.xsd">

	<object>com.warework.service.datastore.query.oo.SampleBean</object>

	<where>
		<and>
			<expression>
				<attribute>name</attribute>
				<operator>NOT_LIKE</operator>
				<value-operand>
					<type>java.lang.String</type>
					<value>James</value>
				</value-operand>
			</expression>
			<or>
				<expression>
					<attribute>name</attribute>
					<operator>NOT_LIKE</operator>
					<value-operand>
						<type>java.lang.String</type>
						<value>Arnold</value>
					</value-operand>
				</expression>
				<expression>
					<attribute>name</attribute>
					<operator>IS_NOT_NULL</operator>
				</expression>
			</or>
		</and>
	</where>

	<order-by>
		<asc attribute="name" />
		<desc attribute="birthDate" />
		<asc attribute="phone" />
	</order-by>

	<page number="2" size="9" />

</query>